{
  "decision_id": "01ARZ3NDEKTSV4RRFFQ69G5FAA",
  "context": "Selection of statistical analysis method for dataset",
  "options": [
    {"option_id": "OPT-001", "description": "Bayesian approach", "pros": ["Handles uncertainty well", "Suitable for small samples"]},
    {"option_id": "OPT-002", "description": "Frequentist approach", "pros": ["Industry standard", "Computational efficiency"]}
  ],
  "chosen": "OPT-001",
  "rationale": "Bayesian approach better handles small sample size and uncertainty in parameters",
  "decision_maker_id": "01ARZ3NDEKTSV4RRFFQ69G5FAB",
  "status": "approved",
  "prov_id": "01ARZ3NDEKTSV4RRFFQ69G5FC1",
  "created_at": "2026-04-15T10:30:00Z",
  "updated_at": "2026-04-16T14:00:00Z"
}
